{
  "$schema": "https://json-schema.org/draft/2020-12/schema",
  "$id": "https://soroushneyestani.github.io/Braille-Hub/spec/fa-ir/schema/rule.schema.json",
  "title": "Persian Braille Rule",
  "description": "Schema for one auditable, profile-scoped Persian Braille rule. A rule is not normative merely because it validates against this schema.",
  "type": "object",
  "additionalProperties": false,
  "required": [
    "schemaVersion",
    "id",
    "profile",
    "type",
    "status",
    "version",
    "direction",
    "input",
    "output",
    "evidence",
    "conformance"
  ],
  "properties": {
    "schemaVersion": {
      "type": "integer",
      "const": 1
    },
    "id": {
      "type": "string",
      "pattern": "^FA-[A-Z0-9]+(?:-[A-Z0-9]+)*-\\d{3,}$",
      "examples": [
        "FA-G1-LETTER-003",
        "FA-G1-PUNC-ELLIPSIS-001"
      ]
    },
    "profile": {
      "type": "string",
      "pattern": "^[a-z]{2,3}(?:-[a-z0-9]+)+$",
      "examples": [
        "fa-ir-g1"
      ]
    },
    "type": {
      "type": "string",
      "enum": [
        "character",
        "sequence",
        "context",
        "normalization",
        "mode",
        "layout"
      ]
    },
    "status": {
      "type": "string",
      "enum": [
        "draft",
        "candidate",
        "normative",
        "deprecated"
      ]
    },
    "version": {
      "type": "string",
      "pattern": "^\\d+\\.\\d+\\.\\d+(?:-[0-9A-Za-z.-]+)?$",
      "description": "Semantic version of this rule artifact."
    },
    "direction": {
      "type": "string",
      "enum": [
        "forward"
      ],
      "description": "Phase 2 defines forward print-to-Braille rules only. Reverse translation will use a later schema/version."
    },
    "priority": {
      "type": "integer",
      "minimum": 0,
      "default": 1000,
      "description": "Deterministic rule precedence. Lower values run earlier. Equal-priority overlap must be rejected by semantic validation."
    },
    "input": {
      "type": "object",
      "additionalProperties": false,
      "required": [
        "kind"
      ],
      "properties": {
        "kind": {
          "type": "string",
          "enum": [
            "scalar",
            "sequence",
            "context",
            "structural"
          ]
        },
        "text": {
          "type": "string",
          "minLength": 1
        },
        "codePoints": {
          "type": "array",
          "items": {
            "type": "string",
            "pattern": "^U\\+[0-9A-F]{4,6}$",
            "examples": [
              "U+067E",
              "U+2026"
            ]
          },
          "minItems": 1,
          "uniqueItems": false
        },
        "before": {
          "type": [
            "string",
            "null"
          ]
        },
        "after": {
          "type": [
            "string",
            "null"
          ]
        },
        "tokenClass": {
          "type": [
            "string",
            "null"
          ]
        }
      },
      "allOf": [
        {
          "if": {
            "properties": {
              "kind": {
                "enum": [
                  "scalar",
                  "sequence",
                  "context"
                ]
              }
            }
          },
          "then": {
            "required": [
              "text",
              "codePoints"
            ]
          }
        }
      ]
    },
    "output": {
      "type": "object",
      "additionalProperties": false,
      "required": [
        "cells"
      ],
      "properties": {
        "cells": {
          "type": "array",
          "items": {
            "type": "string",
            "description": "Braille dot pattern for one cell. '0' is the blank Braille cell. Otherwise digits 1-8 identify raised dots. Canonical ordering and duplicate-dot rejection are semantic validator responsibilities.",
            "pattern": "^(?:0|[1-8]{1,8})$",
            "examples": [
              "1",
              "1234",
              "3456",
              "0"
            ]
          },
          "minItems": 0
        },
        "unicodeBraille": {
          "type": [
            "string",
            "null"
          ],
          "description": "Canonical Unicode Braille rendering when every output cell is representable in U+2800-U+28FF. Null for structural/virtual output."
        },
        "structuralToken": {
          "type": [
            "string",
            "null"
          ],
          "description": "Optional non-cell output token for layout/host-aware rules."
        }
      }
    },
    "normalization": {
      "type": "object",
      "additionalProperties": false,
      "properties": {
        "form": {
          "type": "string",
          "enum": [
            "none",
            "NFC",
            "NFD",
            "NFKC",
            "NFKD"
          ]
        },
        "canonicalInput": {
          "type": [
            "string",
            "null"
          ]
        },
        "notes": {
          "type": [
            "string",
            "null"
          ]
        }
      }
    },
    "evidence": {
      "type": "object",
      "additionalProperties": false,
      "required": [
        "decisionItemIds",
        "sourceIds",
        "rationale"
      ],
      "properties": {
        "decisionItemIds": {
          "type": "array",
          "items": {
            "type": "string",
            "pattern": "^FA-[A-Z0-9][A-Z0-9-]*$"
          },
          "minItems": 1,
          "uniqueItems": true
        },
        "sourceIds": {
          "type": "array",
          "items": {
            "type": "string",
            "pattern": "^SRC-[A-Z0-9][A-Z0-9-]*$"
          },
          "minItems": 1,
          "uniqueItems": true
        },
        "rationale": {
          "type": "string",
          "minLength": 1
        },
        "conflictsResolved": {
          "type": "array",
          "items": {
            "type": "string",
            "minLength": 1
          },
          "default": []
        }
      }
    },
    "conformance": {
      "type": "object",
      "additionalProperties": false,
      "required": [
        "vectorIds"
      ],
      "properties": {
        "vectorIds": {
          "type": "array",
          "items": {
            "type": "string",
            "pattern": "^FA-CONF-[A-Z0-9]+(?:-[A-Z0-9]+)*-\\d{3,}$"
          },
          "minItems": 1,
          "uniqueItems": true
        }
      }
    },
    "notes": {
      "type": "array",
      "items": {
        "type": "string"
      },
      "default": []
    }
  }
}
