{
  "schemaVersion": 1,
  "id": "FA-G1-LETTER-020",
  "profile": "fa-ir-g1",
  "type": "character",
  "status": "candidate",
  "version": "0.1.0",
  "direction": "forward",
  "priority": 1000,
  "input": {
    "kind": "scalar",
    "text": "ظ",
    "codePoints": [
      "U+0638"
    ]
  },
  "output": {
    "cells": [
      "123456"
    ],
    "unicodeBraille": "⠿",
    "structuralToken": null
  },
  "normalization": {
    "form": "none",
    "canonicalInput": "ظ",
    "notes": "Phase 2.2 does not promote unresolved global Unicode normalization policy."
  },
  "evidence": {
    "decisionItemIds": [
      "FA-CORE-020"
    ],
    "sourceIds": [
      "SRC-IR-1393",
      "SRC-LIBLOUIS-2053",
      "SRC-LIBLOUIS-G1",
      "SRC-LIBLOUIS-2054",
      "SRC-UNICODE-BRAILLE"
    ],
    "rationale": "Pinned stable and draft mappings agree, and the institutional 1393/2014 manual is reported by SRC-LIBLOUIS-2053 to match the core alphabet on printed pages 32-33.",
    "conflictsResolved": []
  },
  "conformance": {
    "vectorIds": [
      "FA-CONF-LETTER-020"
    ]
  },
  "notes": [
    "Generated from a Phase 1 CONSENSUS-CANDIDATE decision.",
    "Candidate status is non-normative."
  ]
}
