{
  "schemaVersion": 1,
  "id": "FA-G1-NUMRULE-005",
  "profile": "fa-ir-g1",
  "type": "context",
  "status": "candidate",
  "version": "0.1.0",
  "direction": "forward",
  "priority": 100,
  "input": {
    "kind": "context",
    "text": ".",
    "codePoints": [
      "U+002E"
    ],
    "before": "digit",
    "after": "digit",
    "tokenClass": "numeric-decimal-separator"
  },
  "output": {
    "cells": [
      "2"
    ],
    "unicodeBraille": "⠂",
    "structuralToken": null
  },
  "normalization": {
    "form": "none",
    "canonicalInput": ".",
    "notes": "No additional normalization is applied by this rule."
  },
  "evidence": {
    "decisionItemIds": [
      "FA-NUMRULE-005"
    ],
    "sourceIds": [
      "SRC-LIBLOUIS-2054",
      "SRC-LIBLOUIS-G1"
    ],
    "rationale": "Stable and draft implementations agree on this numeric begin/middle/decimal/end behavior. Because its meaning depends on numeric context, the project accepts it as a context rule rather than an unconditional character mapping.",
    "conflictsResolved": []
  },
  "conformance": {
    "vectorIds": [
      "FA-CONF-NUMRULE-005"
    ]
  },
  "notes": [
    "Generated from an explicitly approved Phase 2.14 adjudication.",
    "Adjudication record: FA-ADJ-NUMRULE-005-001.",
    "The historical Phase 1 classification remains REVIEW-REQUIRED.",
    "Candidate admission does not imply normative promotion."
  ]
}
