{
  "schemaVersion": 1,
  "id": "FA-G1-LAYOUT-011",
  "profile": "fa-ir-g1",
  "type": "layout",
  "status": "candidate",
  "version": "0.1.0",
  "direction": "forward",
  "priority": 1000,
  "input": {
    "kind": "scalar",
    "text": " ",
    "codePoints": [
      "U+2003"
    ]
  },
  "output": {
    "cells": [],
    "unicodeBraille": null,
    "structuralToken": "layout:inline-spacing:U+2003"
  },
  "normalization": {
    "form": "none",
    "canonicalInput": " ",
    "notes": "No global Unicode normalization is implied. Structural normalization/layout semantics are expressed by this rule's type and structural token."
  },
  "evidence": {
    "decisionItemIds": [
      "FA-WS-011"
    ],
    "sourceIds": [
      "SRC-IR-1393",
      "SRC-LIBLOUIS-2053",
      "SRC-LIBLOUIS-2054",
      "SRC-LIBLOUIS-G1"
    ],
    "rationale": "Stable and draft implementations agree on this whitespace/layout behavior through the shared spaces utility and any identical Persian-local override. The project accepts it as host/layout policy rather than treating the whitespace code point as an ordinary Persian Braille character rule.",
    "conflictsResolved": []
  },
  "conformance": {
    "vectorIds": [
      "FA-CONF-LAYOUT-011"
    ]
  },
  "notes": [
    "Generated from an explicitly approved Phase 2.14 adjudication.",
    "Adjudication record: FA-ADJ-WS-011-001.",
    "The historical Phase 1 classification remains REVIEW-REQUIRED.",
    "Candidate admission does not imply normative promotion."
  ]
}
